id,name,code,parent_id:id,type,user_type:id,reconcile
56313,ขาดทุนจากการแลกเปลี่ยนเงินตรา,56313,563,Regular,account.data_account_type_expense,FALSE
56314,ขาดทุนจากการแลกเปลี่ยนสินทรัพย์,56314,563,Regular,account.data_account_type_expense,FALSE
56315,ค่าตกแต่งตัดจ่าย(ย้าย สนง.),56315,563,Regular,account.data_account_type_expense,FALSE
56316,ค่าใช้จ่ายเบ็ดเตล็ด,56316,563,Regular,account.data_account_type_expense,FALSE
56317,ค่าใช้จ่ายต้องห้าม,56317,563,Regular,account.data_account_type_expense,FALSE
56318,ทรัพย์สินสูญหาย,56318,563,Regular,account.data_account_type_expense,FALSE
56319,Donation,56319,563,Regular,account.data_account_type_expense,FALSE
56320,ภาษีเงินได้,56320,563,Regular,account.data_account_type_expense,FALSE
564,ค่าใช้จ่ายด้านพนักงาน,564,56,View,account.data_account_type_view,FALSE
56400,เงินเดือนพนักงาน Office,56400,564,Regular,account.data_account_type_expense,FALSE
56401,โบนัสพนักงาน Office,56401,564,Regular,account.data_account_type_expense,FALSE
56402,ค่าล่วงเวลาและเบี้ยเลี้ยงพนักงาน Office,56402,564,Regular,account.data_account_type_expense,FALSE
56403,ค่ารักษาพยาบาลพนักงาน Office,56403,564,Regular,account.data_account_type_expense,FALSE
56404,ค่าประกันภัยสุขภาพพนักงาน Office,56404,564,Regular,account.data_account_type_expense,FALSE
56405,ค่าใช้จ่ายการอบรมสัมนาพนักงาน Office,56405,564,Regular,account.data_account_type_expense,FALSE
56406,Uniform Office,56406,564,Regular,account.data_account_type_expense,FALSE
56407,ค่าใช้จ่ายในการสนับสนุนเพื่อการศึกษา,56407,564,Regular,account.data_account_type_expense,FALSE
56408,เงินประกันสังคม,56408,564,Regular,account.data_account_type_expense,FALSE
56409,เงินสมทบกองทุนเงินทดแทนประจำปี,56409,564,Regular,account.data_account_type_expense,FALSE
56410,เงินสมทบกองทุนค่าจ้างประจำปี,56410,564,Regular,account.data_account_type_expense,FALSE
56411,ค่าวารสารและสมาชิก,56411,564,Regular,account.data_account_type_expense,FALSE
56412,ค่าสวัสดิการพนักงานอื่น ๆ,56412,564,Regular,account.data_account_type_expense,FALSE
56413,ค่าใช้จ่ายในการพาพนักงานไปเที่ยวประจำปี,56413,564,Regular,account.data_account_type_expense,FALSE
56414,เงินชดเชยพนักงานเมื่อเกษียณอายุ,56414,564,Regular,account.data_account_type_expense,FALSE
57,ค่าเสื่อมราคา,57,5,View,account.data_account_type_view,FALSE
57100,ค่าเสื่อมราคา-อาคาร,57100,57,Regular,account.data_account_type_expense,FALSE
57200,ค่าเสื่อมราคา-ส่วนปรับปรุงที่ดิน,57200,57,Regular,account.data_account_type_expense,FALSE
57300,ค่าเสื่อมราคา-ส่วนปรับปรุงอาคาร,57300,57,Regular,account.data_account_type_expense,FALSE
57400,ค่าเสื่อมราคา-เฟอร์นิเจอร์,57400,57,Regular,account.data_account_type_expense,FALSE
57500,ค่าเสื่อมราคา-เครื่องตกแต่งและติดตั้ง,57500,57,Regular,account.data_account_type_expense,FALSE
57600,ค่าเสื่อมราคา-อุปกรณ์สำนักงาน,57600,57,Regular,account.data_account_type_expense,FALSE
57700,ค่าเสื่อมราคา-เครื่องมือและสินทรัพย์อื่น,57700,57,Regular,account.data_account_type_expense,FALSE
57800,ค่าเสื่อมราคา-ยานพาหนะ,57800,57,Regular,account.data_account_type_expense,FALSE
57900,ค่าเสื่อมราคา-ซอฟท์แวร์บัญชี,57900,57,Regular,account.data_account_type_expense,FALSE
